{
  "$schema": "https://json-schema.org/draft/2020-12/schema",
  "$id": "https://qory.dev/contracts/forager/v1/link-refusal.schema.json",
  "title": "Link refusal",
  "description": "The body of a coded refusal on a gateway's link, application/json: on the local link unsigned, the socket's peer authenticated by its uid; behind a separate gateway signed under a key the run key names, over the connection and the request, a 410 included. The code, the names it concerns, who refused, and the text the session gives the user as the run's error. Every 410 on the link has this body, with the code and the from of the run's end at the gateway, and the state and the reason of that end when it ended the run. A member Forager does not recognise is ignored.",
  "type": "object",
  "additionalProperties": true,
  "required": ["error", "from"],
  "properties": {
    "error": {
      "description": "The refusal code: the gateway's, or the server's, passed on with its status.",
      "type": "string",
      "pattern": "^[a-z][a-z0-9_]{0,63}$"
    },
    "names": {
      "description": "The names the refusal concerns, as dev.qory.run.refused contains them. A name never carries a value. Absent when the refusal concerns none.",
      "$ref": "events/run.refused.schema.json#/properties/names"
    },
    "message": {
      "description": "The text the session gives the user as the run's error, today's text word for word, on every refusal of the link: the 403, 409, 400 and 410, the server's passed on, and the 500 internal of a run that fails to open for a reason without a code. For a refusal of the server's it names Qory Apiary's URL as today. A session that reads none uses the code. It may span lines: tab and newline are its only control characters, and every other C0 control character, DEL and every C1 control character, U+0080 to U+009F, is refused. It holds no secret and no image reference.",
      "type": "string",
      "minLength": 1,
      "maxLength": 8192,
      "pattern": "^[^\u0000-\u0008\u000b-\u001f\u007f-\u009f]*$"
    },
    "from": {
      "description": "Who refused: gateway, the gateway itself, or apiary, the server, whose refusal the gateway passes on with its code and status.",
      "type": "string",
      "enum": ["gateway", "apiary"]
    },
    "state": {
      "description": "On a 410 that ends a run, how the run ended at the gateway: the state of the gateway's dev.qory.run.exited of it, which the session records in the session's dev.qory.run.exited. Absent on every other refusal, and on a 410 of a run that ended otherwise, run_closed.",
      "$ref": "events/run.exited.schema.json#/properties/state"
    },
    "reason": {
      "description": "On a 410 that ends a run, the reason of the gateway's dev.qory.run.exited of it: Forager's code, or the code the run's starter gave. The session records it in the session's dev.qory.run.exited. Absent when the run ended with no reason, as when its starter gave an outcome and none, and on every other refusal.",
      "$ref": "events/run.exited.schema.json#/properties/reason"
    }
  }
}
